[
  {
    "id": "oddity-0001",
    "displayId": "ODD-0001",
    "sec": "",
    "code": "",
    "var": "",
    "status": "unlisted",
    "type": "error",
    "groups": ["errors"],
    "title": "Double Obverse NYC Transit Token",
    "borough": "Manhattan",
    "mat": "B",
    "form": "R",
    "symbol": "Sd",
    "size": 22,
    "obv": "",
    "rev": "",
    "desc": "Token struck with obverse dies on both sides.",
    "notes": "",
    "val": null,
    "rel": ["NY630AT"],
    "home": false,
    "pub": true,
    "sort": "odd-0001"
  },
  {
    "id": "oddity-0002",
    "displayId": "ODD-0002",
    "sec": "",
    "code": "",
    "var": "",
    "status": "unlisted",
    "type": "error",
    "groups": ["errors"],
    "title": "NY630AO Unpunched Variety",
    "borough": "Manhattan",
    "mat": "",
    "form": "R",
    "symbol": "",
    "size": null,
    "obv": "",
    "rev": "",
    "desc": "Unpunched variety of NY630AO.",
    "notes": "The punch-out portion of the design was not cut out.",
    "val": null,
    "rel": ["NY630AO"],
    "home": false,
    "pub": true,
    "sort": "odd-0002"
  },
  {
    "id": "oddity-0003",
    "displayId": "ODD-0003",
    "sec": "",
    "code": "",
    "var": "",
    "status": "unlisted",
    "type": "error",
    "groups": ["errors"],
    "title": "NY630AP Unpunched Variety",
    "borough": "Manhattan",
    "mat": "",
    "form": "R",
    "symbol": "",
    "size": null,
    "obv": "",
    "rev": "",
    "desc": "Unpunched variety of NY630AP.",
    "notes": "The punch-out portion of the design was not cut out.",
    "val": null,
    "rel": ["NY630AP"],
    "home": false,
    "pub": true,
    "sort": "odd-0003"
  },
  {
    "id": "oddity-0004",
    "displayId": "ODD-0004",
    "sec": "",
    "code": "",
    "var": "",
    "status": "unlisted",
    "type": "error",
    "groups": ["errors"],
    "title": "NY630AS Mispunched Variety",
    "borough": "Manhattan",
    "mat": "",
    "form": "R",
    "symbol": "",
    "size": null,
    "obv": "",
    "rev": "",
    "desc": "Mispunched variety of NY630AS.",
    "notes": "The punch-out portion of the design was punched incorrectly.",
    "val": null,
    "rel": ["NY630AS"],
    "home": false,
    "pub": true,
    "sort": "odd-0004"
  },
  {
    "id": "oddity-0005",
    "displayId": "ODD-0005",
    "sec": "",
    "code": "",
    "var": "",
    "status": "unlisted",
    "type": "error",
    "groups": ["errors"],
    "title": "NY630AS Unpunched Variety",
    "borough": "Manhattan",
    "mat": "",
    "form": "R",
    "symbol": "",
    "size": null,
    "obv": "",
    "rev": "",
    "desc": "Unpunched variety of NY630AS.",
    "notes": "The punch-out portion of the design was not cut out.",
    "val": null,
    "rel": ["NY630AS"],
    "home": false,
    "pub": true,
    "sort": "odd-0005"
  },
  {
    "id": "oddity-0006",
    "displayId": "ODD-0006",
    "sec": "",
    "code": "",
    "var": "",
    "status": "unlisted",
    "type": "error",
    "groups": ["errors"],
    "title": "NY631E Unpunched Variety",
    "borough": "Queens",
    "mat": "",
    "form": "R",
    "symbol": "",
    "size": null,
    "obv": "",
    "rev": "",
    "desc": "Unpunched variety of NY631E.",
    "notes": "The punch-out portion of the design was not cut out.",
    "val": null,
    "rel": ["NY631E"],
    "home": false,
    "pub": true,
    "sort": "odd-0006"
  }
]
