[
  {
    "id": "official-ny515",
    "displayId": "TR-NY-515-A",
    "sec": "TR",
    "code": "515",
    "var": "",
    "status": "listed",
    "type": "transportation-related",
    "groups": [
      "transitrelated"
    ],
    "title": "Department of Marine Aviation / LaGuardia Field",
    "borough": "Queens",
    "mat": "Bz",
    "form": "Ch",
    "symbol": "",
    "size": 23,
    "obv": "DEPT. OF MARINE AVIATION / LAGUARDIA FIELD",
    "rev": "Good For One Admission NYC",
    "desc": "Listed transportation-related token.",
    "notes": "Listed in the Atwood-Coffee Transportation Related category as New York - New York City: Queens NY515A. Details in Farebox: March, 2020.",
    "val": null,
    "rel": [],
    "home": false,
    "pub": true,
    "sort": "tr-515"
  }
]
