[
  {
    "id": "official-ct-ny-1",
    "displayId": "CT-NY-1",
    "sec": "CT",
    "code": "NY-1",
    "var": "",
    "status": "listed",
    "type": "club",
    "groups": ["clubtour"],
    "title": "Motor Bus Society 1948-1998 Fifty Years of Preserving History",
    "borough": "Manhattan",
    "mat": "B",
    "form": "R",
    "symbol": "Sd",
    "size": 39,
    "obv": "MOTOR BUS SOCIETY 1948-1998 FIFTY YEARS OF PRESERVING HISTORY (OLD DOUBLE-DECK BUS WITH 50-MBS ON FRONT) YELLOW COACH MODEL Z",
    "rev": "Good For One Tour New York, NY 50th Anniversary April 17-19, 1998",
    "desc": "Club tour token issued for the Motor Bus Society 50th Anniversary events in New York City.",
    "notes": "Brass example listed as New York CT (2), number 1. Contemporary Farebox commentary described these as thick, heavy, proof-like pieces and among the most attractive tour tokens produced. Additional off-catalog examples were reportedly struck in other metals, but only the tour tokens actually used and readily available were cataloged. Offered to collectors in 1998 for $3 plus $1 postage and handling.",
    "maker": "Masterpiece Medallions, Claremont, CA",
    "issued": "1998",
    "mintage": 755,
    "usage": "Used for the Saturday night sightseeing tour.",
    "sources": [
      {
        "title": "Farebox",
        "issue": "May 1998",
        "page": 57,
        "note": "Announcement notes that NY CT-1 and CT-2 were struck by Masterpiece Medallions and that other off-catalog metals exist."
      },
      {
        "title": "Farebox",
        "issue": "May 1998",
        "page": 61,
        "note": "Notes usage, maker location, and original collector offering price."
      }
    ],
    "val": 7.5,
    "rel": [],
    "home": false,
    "pub": true,
    "sort": "ct-ny-1"
  },
  {
    "id": "official-ct-ny-2",
    "displayId": "CT-NY-2",
    "sec": "CT",
    "code": "NY-2",
    "var": "",
    "status": "listed",
    "type": "club",
    "groups": ["clubtour"],
    "title": "Motor Bus Society 1948-1998 Fifty Years of Preserving History",
    "borough": "Manhattan",
    "mat": "WM",
    "form": "R",
    "symbol": "Sd",
    "size": 39,
    "obv": "MOTOR BUS SOCIETY 1948-1998 FIFTY YEARS OF PRESERVING HISTORY (OLD DOUBLE-DECK BUS WITH 50-MBS ON FRONT) YELLOW COACH MODEL Z",
    "rev": "Good For One Tour New York, NY 50th Anniversary April 17-19, 1998",
    "desc": "Club tour token issued for the Motor Bus Society 50th Anniversary events in New York City.",
    "notes": "White metal example listed as New York CT (2), number 2. Contemporary Farebox commentary described these as thick, heavy, proof-like pieces and among the most attractive tour tokens produced. Additional off-catalog examples were reportedly struck in other metals, but only the tour tokens actually used and readily available were cataloged. Offered to collectors in 1998 for $5 plus $1 postage and handling.",
    "maker": "Masterpiece Medallions, Claremont, CA",
    "issued": "1998",
    "mintage": 200,
    "usage": "Used for the daytime trips.",
    "sources": [
      {
        "title": "Farebox",
        "issue": "May 1998",
        "page": 57,
        "url": "/resources/farebox/1998-05.pdf",
        "note": "Announcement notes that NY CT-1 and CT-2 were struck by Masterpiece Medallions and that other off-catalog metals exist."
      },
      {
        "title": "Farebox",
        "issue": "May 1998",
        "page": 61,
        "url": "/resources/farebox/1998-05.pdf",
        "note": "Notes usage, maker location, and original collector offering price."
      }
    ],
    "val": 7.5,
    "rel": [],
    "home": false,
    "pub": true,
    "sort": "ct-ny-2"
  }
]
