[
  {
    "id": "official-ny632a",
    "displayId": "NY632A",
    "sec": "632",
    "code": "A",
    "var": "",
    "status": "listed",
    "type": "transit",
    "groups": ["statenisland"],
    "title": "Richmond L. & R.R. Co. Staten Island, N.Y.",
    "borough": "Staten Island",
    "mat": "WM",
    "form": "R",
    "symbol": "R",
    "size": 16,
    "obv": "RICHMOND L. & R.R. CO. STATEN ISLAND, N.Y.",
    "rev": "Good For One Fare J.J. Kuhn Receiver",
    "desc": "Listed transit token.",
    "notes": "J.J. Kuhn served as receiver from April 27, 1920 until August 1, 1923. Tokens were placed in use in 1921 when the fare increased to 8¢ cash or two tokens for 15¢. Streetcar service was discontinued January 24, 1934, after which the system continued as an all-bus operation.",
    "issued": "1921",
    "sources": [
      {
        "title": "Atwood-Coffee Catalogue",
        "issue": "Volume 2",
        "page": 378,
        "note": "Staten Island 632 section gives receiver dates, 1921 token-use context, and later service history."
      }
    ],
    "val": 12,
    "rel": [],
    "home": false,
    "pub": true,
    "sort": "632-a"
  },
  {
    "id": "official-ny632b",
    "displayId": "NY632B",
    "sec": "632",
    "code": "B",
    "var": "",
    "status": "listed",
    "type": "transit",
    "groups": ["statenisland"],
    "title": "Department of Transportation / Good For One Fare NYC",
    "borough": "Staten Island",
    "mat": "B",
    "form": "R",
    "symbol": "Sd",
    "size": 25,
    "obv": "DEPARTMENT OF TRANSPORTATION / GOOD FOR ONE FARE NYC",
    "rev": "Staten Island Ferry New York City (ferry) GD",
    "desc": "Listed transit token.",
    "notes": "Staten Island Ferry tokens were struck for use with a proposed 50¢ fare. The 50¢ fare was postponed in June 1982, and these tokens were stored in vaults until a fare increase.",
    "issued": "1982",
    "mintage": 900000,
    "usage": "Intended for Staten Island Ferry fare use.",
    "sources": [
      {
        "title": "Atwood-Coffee Catalogue",
        "issue": "Volume 2",
        "page": 378,
        "note": "Staten Island 632 section states the ferry had 1,000,000 total tokens struck for a new 50¢ fare; existing notes identify this brass issue as 900,000 struck in 1982."
      }
    ],
    "val": 3.5,
    "rel": [],
    "home": false,
    "pub": true,
    "sort": "632-b"
  },
  {
    "id": "official-ny632c",
    "displayId": "NY632C",
    "sec": "632",
    "code": "C",
    "var": "",
    "status": "listed",
    "type": "transit",
    "groups": ["statenisland"],
    "title": "Department of Transportation / Good For One Fare NYC",
    "borough": "Staten Island",
    "mat": "WM",
    "form": "R",
    "symbol": "Sd",
    "size": 25,
    "obv": "DEPARTMENT OF TRANSPORTATION / GOOD FOR ONE FARE NYC",
    "rev": "Staten Island Ferry New York City (ferry) GD",
    "desc": "Listed transit token.",
    "notes": "White metal issue struck in 1982 but not used. Staten Island Ferry tokens were struck for use with a proposed 50¢ fare, which was postponed in June 1982.",
    "issued": "1982",
    "mintage": 100000,
    "usage": "Intended for Staten Island Ferry fare use, but not placed in use.",
    "sources": [
      {
        "title": "Atwood-Coffee Catalogue",
        "issue": "Volume 2",
        "page": 378,
        "note": "Staten Island 632 section states the ferry had 1,000,000 total tokens struck for a new 50¢ fare; existing notes identify this white metal issue as 100,000 struck in 1982 and unused."
      }
    ],
    "val": 3.5,
    "rel": [],
    "home": false,
    "pub": true,
    "sort": "632-c"
  },
  {
    "id": "official-ny632d",
    "displayId": "NY632D",
    "sec": "632",
    "code": "D",
    "var": "",
    "status": "listed",
    "type": "transit",
    "groups": ["statenisland"],
    "title": "Triborough Bridge and Tunnel Authority",
    "borough": "Staten Island",
    "mat": "S",
    "form": "R",
    "symbol": "Sd",
    "size": 28,
    "obv": "TRIBOROUGH BRIDGE AND TUNNEL AUTHORITY / (CREST OF BRIDGE OVER TBTA)",
    "rev": "Staten Island Resident Verrazano / Narrows Bridge M",
    "desc": "Listed transit token.",
    "notes": "Brass-plated.",
    "val": 15,
    "rel": [],
    "home": false,
    "pub": true,
    "sort": "632-d"
  },
  {
    "id": "official-ny632e",
    "displayId": "NY632E",
    "sec": "632",
    "code": "E",
    "var": "",
    "status": "listed",
    "type": "transit",
    "groups": ["statenisland"],
    "title": "A Carousel For All Children / At Willowbrook Park",
    "borough": "Staten Island",
    "mat": "B",
    "form": "R",
    "symbol": "Sd",
    "size": 29,
    "obv": "A CAROUSEL FOR ALL CHILDREN / AT WILLOWBROOK PARK / (2 MAPLE LEAVES)(CAROUSEL HORSE)",
    "rev": "A Greenbelt Conservancy Inc. Project / Staten Island New York / Good For 1 Ride",
    "desc": "Listed transit token.",
    "notes": "",
    "val": 3.5,
    "rel": [],
    "home": false,
    "pub": true,
    "sort": "632-e"
  }
]
